title,provider,summary
Weekly Stock List,provide,"The Technology sector has led the market recovery from the COVID-19 depths of late March.  Through April 30, the sector was flat for the year, compared to a 10% decline for the S&P 500. The sector is the largest in the U.S. market and now accounts for almost 26% of the S&P 500.  Over the long term, we expect the Tech sector to benefit from pervasive digitization across the economy, greater acceptance of transformative technologies, and the development of the Internet of Things (IoT). Healthy company and sector fundamentals are also positive. For individual companies, these include high cash levels, low debt, and broad international business exposure. We have an Over-Weight rating on the Tech sector and think investors should look to allocate up to 30% of their diversified portfolios to the group.  Here is how we use our analysts' Tech sector ideas in our Focus List and Model Portfolios."
Analyst Report: Apple Inc,provide,"Apple manufactures Smartphones, tablets, PCs, software and peripherals for a worldwide customer base. Its products include Mac desktop and mobile PCs, iPhone, iPad, Apple Watch, and various consumer products, including AirPods, Beats headphones and Apple TV. Apple services include App Store, iTunes, iCloud, Apple TV+, Apple Arcade, Apple Music, Apple Pay, and more."
Market Update:  RJF,provide,"Stocks fell sharply on Friday morning after President Trump threatened to impose new tariffs on China for its handling of the coronavirus crisis. Manufacturing data was also weak. The Institute for Supply Management said that its factory index fell to 41.5 in April, the lowest level since April 2009, from 49.1 in March. Amazon shares fell more than 7% after the company warned that it could post a quarterly loss due to high expenses related to the pandemic. The S&P fell 2.8%, the Dow 2.4%, and the Nasdaq 3.1%. Crude oil rose slightly to $19 per barrel, while gold rose $14 to $1708 per ounce."
Technical Assessment: Bearish in the Intermediate-Term,provide,"During the trading week ended 4/17/20, the stock market balanced horrific economic news (weekly unemployment claims, retail sales, industrial production) with hopeful medical news (positive results for GILD's remedesivir) and the government's three-stage plan to reopen the economy. Although the week was positive for stocks, investors are now realizing that the damage to the economy is extensive and will possibly take years to remediate."
Analyst Report: Apple Inc,provide,"Apple manufactures Smartphones, tablets, PCs, software and peripherals for a worldwide customer base. Its products include Mac desktop and mobile PCs, iPhone, iPad, Apple Watch, and various consumer products, including AirPods, Beats headphones and Apple TV. Apple services include App Store, iTunes, iCloud, Apple TV+, Apple Arcade, Apple Music, Apple Pay, and more."
Market Update: ACC2,provide,"President Trump is preparing to announce new federal guidelines for reopening the pandemic-battered economy. Meanwhile, an additional 5.2 million people filed for unemployment benefits last week, bringing the total number to 22 million over just the past four weeks. Industries trading higher today include Multiline Retail, Biotechnology, and Internet & Direct Marketing Retail. Industries trading lower include Airlines, Energy Equipment & Services, and Consumer Finance. The VIX is up 0.38 at 41.20. The Dow fell 0.4%, the S&P rose 0.3%, and the Nasdaq rose 1.5%. Crude oil traded near $20 per barrel, while gold rose $11 to $1751 per ounce."
Analyst Report: Apple Inc,provide,"Apple manufactures Smartphones, tablets, PCs, software and peripherals for a worldwide customer base. Its products include Mac desktop and mobile PCs, iPhone, iPad, Apple Watch, and various consumer products, including AirPods, Beats headphones and Apple TV. Apple services include App Store, iTunes, iCloud, Apple TV+, Apple Arcade, Apple Music, Apple Pay, and more."
Market Digest:  INCY,provide,"Stocks scored a win in the trading week ended March 27-- as in the best market week in 82 years, even as Friday of that week was a down day. The rally had some investors wondering if 'the low was in.' But in past big selloffs, the confirming low re-test has come months later."
Technical Assessment: Bearish in the Intermediate-Term,provide,"Well we finally had a good Monday in March, as the S&P 500 rose a solid 3.4%. A 3%+ jump during less-volatile times would be phenomenal. Now it is just solid. On the last three Monday's in March, the index plunged 7.6%, crashed 12%, and then saw a ""minor"" decline of 2.9%. Does this mean that Turnaround Tuesday, which has seen gains of 4.9%, 6%, and 9.4% in the past three weeks, will see downside today?"
Analyst Report: Apple Inc,provide,"Apple manufactures Smartphones, tablets, PCs, software and peripherals for a worldwide customer base. Its products include Mac desktop and mobile PCs, iPhone, iPad, Apple Watch, and various consumer products, including AirPods, Beats headphones and Apple TV. Apple services include App Store, iTunes, iCloud, Apple TV+, Apple Arcade, Apple Music, Apple Pay, and more."
Market Update:TOL,provide,"Stocks fell sharply on Thursday morning amid continued coronavirus uncertainty. However, Fed Vice Chair Richard Clarida said that U.S. economic fundamentals remained strong and that it was too soon to tell what impact the coronavirus would have on the economy or interest rate policy. In M&A news, Morgan Stanley said that it would acquire E*Trade Financial in a $13 billion deal. E*Trade shares jumped 24%, while MS fell nearly 4%. The Dow and the S&P were down 1.0%, while the Nasdaq fell 1.4%. Crude oil rose nearly 2% to $54 per barrel, while gold rose $14 to $1626 per ounce."
Analyst Report: Apple Inc,provide,"Apple manufactures Smartphones, tablets, PCs, software and peripherals for a worldwide customer base. Its products include Mac desktop and mobile PCs, iPhone, iPad, Apple Watch, and various consumer products, including AirPods, Beats headphones and Apple TV. Apple services include App Store, iTunes, iCloud, Apple TV+, Apple Arcade, Apple Music, Apple Pay, and more."
Market Digest:  JNPR,provide,Tepid 4Q Earnings Wrap a Lackluster Year for Profits
The Argus ESG Model Portfolio,provide,"Sustainable Impact Investing is gaining traction not only with Argus Research clients, but also with the global investment community. According to the Forum for Sustainable and Responsible Investment, global assets under management in the strategy have grown to $11.6 trillion in 2018 from $178 billion in 2005. The UN Principles for Responsible Investing -- to which Argus Research is a signatory -- now represents more than 1,750 signatories with assets of US$70 trillion, according to BMO Global Asset Management. As assets have flowed in over the past 40 years, Sustainable Impact Investing has evolved. The discipline, originally known as Socially Responsible Investing, focused at first on excluding companies that conducted business in South Africa, or participated in industries such as tobacco, alcohol and firearms. In time, the list of industries to avoid increased to include soft drinks, fast food, and oil and gas, among numerous others. Performance of these initial strategies lagged, and the approach has been modified. Now, instead of merely identifying industries to avoid, the discipline promotes ""sustainable"" business practices across all industries that can have an ""impact"" on global issues such as the climate, hunger, poverty, disease, shelter and workers' rights."
Analyst Report: Apple Inc,provide,"Apple manufactures Smartphones, tablets, PCs, software and peripherals for a worldwide customer base. Its products include Mac desktop and mobile PCs, iPhone, iPad, Apple Watch, and various consumer products, including AirPods, Beats headphones and Apple TV. Apple services include App Store, iTunes, iCloud, Apple TV+, Apple Arcade, Apple Music, Apple Pay, and more."
Market Update:  PPL,provide,"U.S. equities were down on Friday morning following the announcement of new sanctions on Iran. On the economic front, the U.S. Bureau of Labor Statistics reported that nonfarm payroll employment rose by 145,000 in December, and the unemployment rate of 3.5% remained unchanged. Wall Street was expecting an increase of 165,000 jobs. Gains occurred in retail trade and health care, while mining lost jobs. Wages rose to $28.32 per hour in December, up 2.9% compared to a rise of 3.1% a year ago. The Dow Jones Industrial Average fell 0.3%, the S&P 500 0.07% and the Nasdaq Composite was down 0.06%. Crude oil traded at $59 per barrel, while gold rose $7 to $1561 per ounce."
Weekly Stock List,provide,"The major market indices all had solid performances for 2019, closing with raw price gains of 36% for the Nasdaq Composite, 24% for the Dow Jones Industrial Average and 29% for the S&P 500.  Growth stocks outperformed value, as the Russell 1000 Growth Index advanced 40% compared to the Russell 1000 Value Index's gain of 24%. Small-caps underperformed, with the Russell 2000 closing 25% higher.  International stocks underperformed domestic stocks, as the EAFE Index increased 19% and the MSCI Emerging Markets Index advanced 17%."
Weekly Stock List,provide,"Sustainable Impact investing continues to grow.  According to the Forum for Sustainable and Responsible Investment (SRI), assets under management in SRI funds have risen to $8.7 trillion in 2015 from $2.1 trillion in 2003. As assets have flowed in, SRI investing has evolved over the past 40 years.  Now, instead of merely identifying industries to avoid, the discipline promotes ""sustainable"" business practices across all businesses that can have an ""impact"" on global issues such as workers' rights, poverty, hunger and the climate. Based on numerous requests from clients, we have compiled a list of companies followed by Argus Research that are in position to have this type of ""sustainable impact"" on the environment, workplace and community. These firms have exemplary records not only in delivering on the bottom line, but also in improving the environment, contributing to community relations, and showing respect for employees. We derived our list by identifying companies that are either BUY-rated or HOLD-rated by Argus analysts, and also score highly on ESG (Environmental, Social and Governance) criteria established by the JUST Capital Foundation. JUST Capital utilizes a combination of polling, data-driven research, and strategic engagement to shift behaviors and activities in corporate America and the financial markets. JUST Capital's mission is to drive measurable corporate change to create a stakeholder-centric, inclusive form of capitalism that reflects the priorities of the American public.  JUST ranks the Russell 1000 on these criteria against a scale of 1-100. Here are the companies in the Argus Universe that score highest on the scale."
Daily Spotlight: 3Q GDP Growth Final at 2.1%,provide,"The U.S. Department of Commerce announced that its ""third"" estimate for 3Q19 GDP growth was a rate of 2.1%. This was in line with the previous estimates and with the consensus outlook. The report reflects positive trends in the economy, including the all-important personal consumption expenditures (+3.2%), capital investments into intellectual property products (+4.7%) and residential construction (+4.6%), and even federal government spending (+3.3%, led by nondefense spending, which rose at a 5.0% rate). The segments that lagged were capital investment into equipment (-3.8%, which we think is a fall-out from the trade debate) and exports (up only 1.0% and also affected by trade). In short, the headline number looked positive, but the economy is not showing strength across the board. We expect growth in the balance of 2019 and 2020 to fall into the 1.5%-2.3% range, as ongoing trade and tariff uncertainty weigh on business and consumer confidence. The GDP report also includes an inflation gauge, the PCE price index. This index, excluding food and energy, increased at a 2.1% pace, in line with the Federal Reserve's targets."
Technical Assessment: Bullish in the Intermediate-Term,provide,"Washington is as turbulent as ever, buffeted by impeachment proceedings, the trade process, an interim government-spending bill, and the drug-pricing wrangle. On Wall Street, the S&P 500 is quietly grinding higher in small moves with few down days."
Weekly Stock List,provide,"In a volatile period for stocks, we saw increased demand for information from our website, www.ArgusResearch.com.  The most-popular reports are the stock-based Argus Analyst Reports, followed by the daily reports Market Watch, Market Digest and Market Movers. The daily reports contain, in addition to stock picks, information about the latest market and economic trends as well as Argus' forecasts. The homepage of our website also features updates and outlooks.  Here are the stocks in Argus' fundamental coverage that clients viewed the most in the month of November."
The Argus Millennial Generation Model Portfolio,provide,"We have published our latest version of the Argus Millennial Generation portfolio. This new generation of consumers - the Millennials - has recently become the largest demographic cohort in the country, and this group, with new lifestyle preferences and different career goals, is demanding a new menu of sustainable products and services. The intersection of important Millennial trends - sustainability, healthier living, an entrepreneurial spirit - has resulted in the emergence and growth of numerous companies well suited to the new generation. Many of these companies are expected to be future industry leaders and are included in the dynamic Argus Universe of Coverage. A diversified portfolio, of course, is more than just a list of companies linked to themes. To build the Argus Millennial Generation Portfolio, we applied financial concepts such as industry diversification, income generation, risk reduction and growth at a reasonable price."
Analyst Report: Apple Inc,provide,"Apple manufactures Smartphones, tablets, PCs, software and peripherals for a worldwide customer base. Its products include Macintosh desktop and mobile PCs, iPhone, iPad, Apple Watch, and various consumer products, including AirPods, Beats headphones and Apple TV. Apple also owns and operates iTunes, the world's largest vendor of recorded music. Apple derives 42%-45% of its revenue from the Americas, 22%-25% from Europe/MEA, and 24%-30% from the Asia-Pacific region."
Market Update: MAT,provide,"The major indices are down at midday on Thursday on reports that China does not expect to finalize a full trade deal with the Trump administration. Fiat Chrysler (FCAU) announced a merger with French automaker Peugeot that will create the world's fourth-largest auto manufacturer. Industries doing well today include Food Products and Interactive Media & Services. Industries showing weakness include Personal Products, Machinery, and Trading Companies & Distributors. The VIX is up 1.03 to 13.36 after the previous close of 12.33. The Dow fell 0.7%, the S&P 0.6%, and the Nasdaq 0.4%. Crude oil traded near $54 per barrel, while gold rose $15 to $1511 per ounce."
Weekly Stock List,provide,"The Technology sector has led equity markets higher in 2019.  The sector has gained 30% this year, compared to 19% for the S&P 500. The Nasdaq Composite, comprised largely of Tech stocks, is about 1% below an all-time high. The sector is the largest in the U.S. market and now accounts for almost 22% of the S&P 500.  Over the long term, we expect the Tech sector to benefit from pervasive digitization across the economy, greater acceptance of transformative technologies, and the development of the Internet of Things (IoT). Healthy company and sector fundamentals are also positive. For individual companies, these include high cash levels, low debt, and broad international business exposure. We have an Over-Weight ranking on the Tech sector and think investors should look to allocate 22%-25% of their diversified portfolios to the group. Here is how we use our Tech sector ideas in our Focus List and Model Portfolios."
Weekly Stock List,provide,"This is among our most-important themes for 2019, and stretches across industries. We think companies that raise their dividends consistently at a double-digit rate are sending off three important signals amid all the recent market volatility: 1) the company's balance sheet is strong enough to pay a dividend; 2) management is focused on providing shareholder returns; and 3) management is confident enough in the near-term outlook to raise the payout aggressively. This third factor is especially important as the economy cools off into 2020 and earnings growth slows. Here are 11 stocks that meet our double-digit dividend test and are on the Argus BUY List. They are also core holdings in our Dividend Growth Separately Managed Account and in the Dividend Growers Total Return Trust, a Unit Investment Trust sponsored by SmartTrust."
"Market Update: AAPL, SBUX",provide,"U.S. equity markets were up on Wednesday morning following news that China was suspending additional tariffs on some American imports. The Labor Department reported that its producer price index rose 0.1% in August, following a 0.2% gain in July. The cost of services offset the largest fall in the price of goods in seven months. The Dow gained 0.3%, the S&P 0.3%, and the Nasdaq was up 0.7%. Crude oil traded near $58 per barrel, while gold rose $3 to $1502 per ounce."
Analyst Report: Apple Inc,provide,"Apple manufactures Smartphones, tablets, PCs, software and peripherals for a worldwide customer base. Its products include Macintosh desktop and mobile PCs, iPhone, iPad, Apple Watch, and various consumer products, including AirPods, Beats headphones and Apple TV. Apple also owns and operates iTunes, the world's largest vendor of recorded music. Apple derives 42%-45% of its revenue from the Americas, 22%-25% from Europe/MEA, and 24%-30% from the Asia-Pacific region."
"Upside surprise, good guidance; reiterating BUY",provide,"Apple manufactures Smartphones, tablets, PCs, software and peripherals for a worldwide customer base. Its products include Macintosh desktop and mobile PCs, iPhone, iPad, Apple Watch, and various consumer products, including AirPods, Beats headphones and Apple TV. Apple also owns and operates iTunes, the world's largest vendor of recorded music. Apple derives 42%-45% of its revenue from the Americas, 22%-25% from Europe/MEA, and 24%-30% from the Asia-Pacific region."
Market Update:  MO,provide,"Stocks edged higher on Wednesday morning as investors awaited a widely expected interest rate cut by the Federal Reserve, along with comments from Fed Chair Jerome Powell. On the earnings front, Apple shares rose more than 4% after the company posted better-than-expected fiscal 3Q results and provided positive sales guidance for fiscal 4Q. The Dow rose 0.1%, the S&P 0.1%, and the Nasdaq 0.3%. Crude oil rose slightly to about $58 per barrel, while gold fell $2 to $1440 per ounce."
Weekly Stock List,provide,"The G20 summit in Osaka, Japan, ended on a positive note for investors, as President Trump and China's President Xi Jinping scaled back trade and tariff demands over the weekend.  President Trump said he would refrain from imposing additional tariffs on $300 billion worth of Chinese goods, and the U.S. also lifted the technology-transfer ban on companies that had been working with Chinese telcom company Huawei. The two countries are also continuing to renegotiate the tariffs already imposed.  The sectors that had borne the brunt of the trade wars included Information Technology and Industrials.  Here are five BUY-rated stocks that we think are poised to benefit from the cooling trade tensions."
Daily Spotlight: 1Q GDP,provide,"The U.S. Department of Commerce announced that its third estimate for 1Q19 GDP growth was a rate of 3.1%. This was in line with the previous estimates and the consensus outlook. There were positive trends in the economy, including capital investments into Intellectual Products (+12%), Structured (+4.3%), Exports (+5.4%) even Federal Government Spending (+2.8%, led by Defense spending, which rose at a 4.0% rate and State and Government spending, which rose at a 4.6% rate). Segments that lagged were Housing (-2.0%), capital investment into Equipment (-1.0%) and the all-important Personal Consumption Expenditures (up only 0.9%).  In short, the headline number looked positive, but some of the details were sketchy. We expect growth in the balance of 2019 to fall into the 2.0%-2.5% range, as trade and tariff concerns weigh on confidence. The GDP report also includes an inflation gauge, the PCE price index. This index, excluding food and energy, increased a paltry 0.5%. That alone may play into the Fed's plans for cutting rates."
Technical Assessment: Bullish in the Intermediate-Term,provide,"We are raising our intermediate-term outlook to bullish, which now aligns with our long-term outlook. All the major indices have finally recaptured their key 200-day moving averages, with the laggard Russell 2000 (RUT) just retaking this average on Tuesday. The average stock in the S&P 500 is now above its 50-day average (56%) for the first time since early May."
The Argus Sustainable ESG Model Portfolio,provide,"Sustainable Impact Investing is gaining traction with the global investment community. According to the Forum for Sustainable and Responsible Investment, global assets under management in the strategy have grown to $11.6 trillion in 2018 from $178 billion in 2005. The UN Principles for Responsible Investing now represents more than 1,750 signatories with assets of US $70 trillion, according to BMO Global Asset Management. As assets have flowed in over the past 40 years, Sustainable Impact Investing has evolved. The discipline, originally known as Socially Responsible Investing, focused at first on excluding companies that conducted business in South Africa, or participated in industries such as tobacco, alcohol and firearms. In time, the list of industries to avoid increased to include soft drinks, fast food, and oil and gas, among numerous others. Performance of these initial strategies lagged, and the approach subsequently has been modified. Now, instead of merely identifying industries to avoid, the discipline promotes ""sustainable"" business practices across all industries that can have an ""impact"" on global issues such as the climate, hunger, poverty, disease, shelter and workers' rights."
Market Digest: GRUB,provide,"Rally On: Our Monthly Survey of the Economy, Interest Rates, and Markets"
Raising target to $250,provide,"Apple manufactures Smartphones, tablets, PCs, software and peripherals for a worldwide customer base. Its products include Macintosh desktop and mobile PCs, iPhone, iPad, Apple Watch, and various consumer products, including AirPods, Beats headphones and Apple TV. Apple also owns and operates iTunes, the world's largest vendor of recorded music. Apple derives 42%-45% of its revenue from the Americas, 22%-25% from Europe/MEA, and 24%-30% from the Asia-Pacific region."
Market Digest:  JNJ,provide,Economic Data Continues to Send Mixed Signals
QCOM settlement a relief - for AAPL investors; reiterating BUY,provide,"Apple manufactures Smartphones, tablets, PCs, software and peripherals for a worldwide customer base. Its products include Macintosh desktop and mobile PCs, iPhone, iPad, Apple Watch, and various consumer products, including AirPods, Beats headphones and Apple TV. Apple also owns and operates iTunes, the world's largest vendor of recorded music. Apple derives 42%-45% of its revenue from the Americas, 22%-25% from Europe/MEA, and 24%-30% from the Asia-Pacific region."
Millennial Generation Portfolio,provide,A new generation of consumers - the Millennials - has become the largest demographic cohort in the
Daily Spotlight: 4Q GDP ,provide,"The U.S. Department of Commerce announced its ""third"" and final estimate for 4Q18 GDP growth was 2.2%. This is down 40 basis points compared to the ""initial"" estimate of 2.6% and, as we had anticipated, is a further signal that the economy is cooling off from the unsustainable growth rate of 4.2% in 2Q. There were positive trends in the economy, including capital investments into Intellectual Products (+10.7%), Equipment (+6.6%), the all-important Personal Consumer Spending category (+2.5%) and even Federal Government Spending (+1.1%, led by Defense spending, which rose at a 6.4% rate). Segments that lagged were Housing (-4.7%), once again, and State & Local Government Spending (-1.3%).  Exports rebounded from a sharp decline in 3Q that was attributed to tariff talks; but the strong dollar capped export growth at a below-trend 1.8%. The 4Q results benefited from tax cuts, which helped drive consumer spending. But that ""sugar high"" is now in the rear-view mirror. We expect growth in 1H19 in the 1.5%-2.0% range, reflecting disruption in the economy from the government shutdown.  The GDP report also includes an inflation gauge, the PCE price index.  This index, excluding food and energy, increased at a modest 1.8% pace. This report will not likely lead the Fed to alter its current stance."
Mixed reviews for streaming ignore still-powerful ecosystem; reiterating BUY,provide,"Apple manufactures Smartphones, tablets, PCs, software and peripherals for a worldwide customer base. Its products include Macintosh desktop and mobile PCs, iPhone, iPad, Apple Watch, and various consumer products, including AirPods, Beats headphones and Apple TV. Apple also owns and operates iTunes, the world's largest vendor of recorded music. Apple derives 42%-45% of its revenue from the Americas, 22%-25% from Europe/MEA, and 24%-30% from the Asia-Pacific region."
