title,provider,summary
Daily Spotlight: Final 1Q GDP Reading: +6.4%,provide,"The U.S. Department of Commerce last week announced that its third estimate for 1Q20 GDP growth was a rate of 6.4%. This was in line with the previous estimates and with the consensus outlook, and represents a robust recovery. The report also includes an inflation gauge, the PCE price index. This index, excluding food and energy, rose at a 2.5% pace, well ahead the Federal Reserve's inflation target of 2.0%, though the Fed has said that it will allow inflation to run hot for a while before raising short-term interest rates. We expect above-trend GDP growth for the next few quarters. But there may be bumps along the way. Some segments of the economy are back to or above pre-pandemic highs. These include consumer spending on durable and nondurable goods as well as investment into residential and intellectual property products. Other segments continue to lag, such as consumer spending on services, investment into structures, and exports."
Technical Assessment: Bullish in the Intermediate-Term,provide,"In our Wednesday comment, we noted that we don't often try to predict what the U.S. Dollar Index (USD) will do. We also mentioned that the direction of the USD was very important to the euro and to metals. The Fed proved that point on Wednesday, with results that ran into Thursday."
Analyst Report: Apple Inc,provide,"Apple manufactures smartphones, tablets, PCs, software and peripherals for a worldwide customer base. Its products include Mac desktop and mobile PCs, iPhone, iPad, Apple Watch, and various consumer products, including AirPods, Beats headphones and Apple TV. Apple services include App Store, iTunes, iCloud, Apple TV+, Apple Arcade, Apple Music, Apple Pay, and more."
"Market Digest: AAPL, CCL, IP, LNT",provide,"Stocks rose on Thursday as investors looked past more signs of inflation in the government's May consumer price data. The Labor Department said that the CPI rose 5.0% year-over-year in May, up from 4.2% in April. The reading was above the Reuters consensus forecast of 4.7% and the sharpest annual increase since 2008. The core CPI, excluding food and energy, also rose 3.8% from the prior year. On the employment front, first-time jobless claims fell to a new pandemic era low of 376,000, down from the prior week but slightly above consensus. Continuing claims fell to 3.499 million, down from 3.757 million a week earlier and below the consensus forecast of 3.665 million. The Dow rose 0.06%, the S&P 0.47%, and the Nasdaq 0.78%. Crude oil rose slightly to $70 per barrel, while gold fell $6 to $1901 per ounce."
Weekly Stock List,provide,"Sustainable Impact investing continues to grow. According to Opimas, a management consultancy focused on global capital markets, global assets under management in ESG strategies grew to $40.5 trillion in 2020, doubling in four years and tripling in eight. As assets have flowed in, SRI investing has evolved over the past 40 years. Now, instead of merely identifying industries to avoid, the discipline promotes ""sustainable"" business practices across all businesses that can have an ""impact"" on global issues such as workers' rights, poverty, hunger, and the climate. Based on numerous requests from clients, we have compiled a portfolio of companies followed by Argus Research that are in position to have this type of ""sustainable impact"" on the environment, workplace, and community. These firms have exemplary records not only in delivering on the bottom line, but also in improving the environment, contributing to community relations, and showing respect for their employees. We built our portfolio by identifying companies that are BUY-rated by Argus analysts and also score well on ESG (Environmental, Social and Governance) criteria established by the JUST Capital Foundation. JUST Capital utilizes a combination of polling, data-driven research, and strategic engagement to shift behaviors and activities in corporate America and the financial markets. JUST Capital's mission is to drive measurable corporate change to create a stakeholder-centric, inclusive form of capitalism that reflects the priorities of the American public.  JUST ranks the Russell 1000 on these criteria against a scale of 1-100. Here are company highlights from the Argus U.S. ESG Model Portfolio."
Market Update: MDLZ,provide,"Stocks rose modestly on Thursday morning, but gave up strong early gains amid a range of first-quarter earnings reports and new GDP and employment data. Investors also weighed President Biden's ambitious plans for new spending on families and education. The Commerce Department said that the U.S. economy expanded at a 6.4% annualized rate in the first quarter, above the Reuters consensus forecast of 6.1% and up from 4.3% growth in the fourth quarter. The Dow rose 0.1%, the S&P 0.3%, and the Nasdaq 0.1%. Crude oil rose 1.5% to $65 per barrel, while gold traded near $1768 per ounce."
Analyst Report: Apple Inc,provide,"Apple manufactures smartphones, tablets, PCs, software and peripherals for a worldwide customer base. Its products include Mac desktop and mobile PCs, iPhone, iPad, Apple Watch, and various consumer products, including AirPods, Beats headphones and Apple TV. Apple services include App Store, iTunes, iCloud, Apple TV+, Apple Arcade, Apple Music, Apple Pay, and more."
The Argus ESG Model Portfolio,provide,"Sustainable Impact Investing is gaining traction with the global investment community. In January 2020, BlackRock CEO Lawrence Fink, who oversees approximately $9 trillion in assets, announced that his firm would be investing in companies that are making progress on sustainability. He doubled down in his January 2021 letter, calling on company managements to disclose their plans for making their businesses ""compatible with a net-zero economy"" by 2050. As assets have flowed in over the past 40 years, Sustainable Impact Investing has evolved. The discipline, originally known as Socially Responsible Investing, focused at first on excluding companies that conducted business in South Africa, or participated in industries such as tobacco, alcohol, and firearms. But the performance of these initial strategies lagged, and the approach has been modified. Now, instead of merely identifying industries to avoid, the discipline promotes ""sustainable"" business practices across all industries that can have an ""impact"" on global issues such as the climate, hunger, poverty, disease, shelter, and workers' rights."
Daily Spotlight: Final 4Q GDP Reading: 4.3%,provide,"The U.S. Department of Commerce announced that its ""third"" estimate for 2Q20 GDP growth was a rate of 4.3%. This represents a return to more-normal GDP results after 30% swings down and up in 2Q20 and 3Q20. The report also includes an inflation gauge, the PCE price index.  This index, excluding food and energy, rose at a 1.3% pace, well below the Federal Reserve's inflation target of 2.0%. Although the economy has expanded for two quarters in a row, the National Bureau of Economic Research has not yet declared that the recession is over. At $21.49 trillion, the U.S. economy at the end of 4Q was still below its pre-pandemic highs of $21.75 trillion. Some segments of the economy are back to or above pre-pandemic highs. These segments include consumer spending on durable and nondurable goods, and investment into residential and intellectual property products. Other segments continue to lag, such as exports, consumer spending on services, and investment into structures. We anticipate a pick-up in economic growth in 2021, due in part to aggressive government spending."
The Argus Innovation Model Portfolio,provide,"The United States economy is full of innovation. It has to be. Manufacturing industries that dominated the economy decades ago - textiles, televisions, even automobiles, to a large degree - have moved overseas, where costs are lower. Yet the U.S. economy, prior to the pandemic, had expanded to record levels. And now, the U.S. Healthcare industry is mobilizing to improve COVID-19 testing, treatments and vaccines. Consider that U.S. GDP was approximately $1 trillion in 1930 but nearly $22 trillion at the end of 2019. That's growth of 22-times. Meanwhile, the U.S. population has grown less than 3-times during that time span, to 320 million from 120 million. The delta between GDP growth and population growth has been driven in large part by innovation. In addition, the value of listed corporations on U.S. stock exchanges at the end of 2020 was approximately $32 trillion, representing 41% of global equity market capitalization, while U.S. GDP represented only 25% of global GDP. The current low level of interest rates (the benchmark 10-year Treasury bond yield is 1.1%) and the relatively high level of the dollar both attest to the confidence that global investors have in the innovative U.S. economy."
The Argus Millennial Generation Model Portfolio,provide,"There are now more than 80 million Millennials, born between 1982 and 2000 and ranging in age from their early 20s to their late-30s. This generation is the largest in history - bigger than even the Baby Boomers. Yet despite their size, and according to our research, Millennials currently account for 25% of total U.S income - some $3.1 trillion in direct annual purchasing power. Millennials are already coveted by marketers, even though their annual average income is 40% below the spending levels of the generation ahead of them (Gen X) and 30% below the spending levels of Baby Boomers, who are slowing down. But as Millennials rise into their peak earning years, their earnings are expected to grow."
Analyst Report: Apple Inc,provide,"Apple manufactures smartphones, tablets, PCs, software and peripherals for a worldwide customer base. Its products include Mac desktop and mobile PCs, iPhone, iPad, Apple Watch, and various consumer products, including AirPods, Beats headphones and Apple TV. Apple services include App Store, iTunes, iCloud, Apple TV+, Apple Arcade, Apple Music, Apple Pay, and more."
"Market Update: LRCX,",provide,"Stocks rallied on Thursday morning, recovering from Wednesday's selloff, amid lower-than-expected jobless claims. The Labor Department reported that first-time claims for state unemployment benefits fell to 847,000 for the week ended January 23, down from a revised 914,000 a week earlier and below the Bloomberg consensus forecast of 875,000. The Dow rose 1.8%, the S&P 1.6%, and the Nasdaq 0.9%. Crude oil rose to $53 per barrel, while gold traded near $1866 per ounce."
Technical Assessment: Bullish in the Intermediate-Term,provide,"Major technology indices peaked in early September, consolidated for a couple of months, and then broke out to all-time highs (ATHs) and never looked back. But FAANG stocks went nowhere over that more-than four-month period."
Daily Spotlight: Final 3Q GDP Reading: 33.4%,provide,"The U.S. Department of Commerce announced that its ""third"" estimate for the 3Q20 GDP rate of growth was 33.4%. This was in line with the previous estimates and with the consensus outlook, and represented a sharp spike higher from the 31.4% plunge in 2Q. The GDP report also includes an inflation gauge, the PCE price index. This index, excluding food and energy, rose at a 3.4% pace, well ahead the Federal Reserve's inflation target of 2.0% (though the Fed has said it will allow inflation to run hot for a while before raising short-term interest rates). After this reading, we expect that GDP reports going forward should settle into a low- to mid-single-digits rate. But there is still work to be done. At $21.2 trillion, the U.S. economy at the end of 3Q was almost 3% below its pre-pandemic highs. Some segments of the economy are back to or above pre-pandemic highs. These segments consumer spending on durable and nondurable goods, and investment into residential and intellectual property products. Other segments continue to lag, such as consumer spending on services and investment into equipment."
Technical Assessment: Bullish in the Intermediate-Term,provide,"Smaller stocks had another good day on Tuesday, with the Russell 2000 (IWM) jumping 2.5% and the S&P 600 Small Cap (SML) vaulting 2.6%. The S&P 400 Mid Caps also provided leadership once again, popping 2.4%."
Weekly Stock List,provide,"The Technology sector has led the market recovery from the COVID-19 depths of March 2020. Through November 20, the sector was up 31% for the year, compared to a 10% gain for the S&P 500. The Tech sector is the largest in the U.S. market and now accounts for more than 27% of the S&P 500. Over the long term, we expect the Tech sector to benefit from pervasive digitization across the economy, greater acceptance of transformative technologies, and the development of the Internet of Things (IoT): Healthy company and sector fundamentals are also positive. For individual companies, these include high cash levels, low debt, and broad international business exposure. We have an Over-Weight ranking on the Tech sector and think investors should look to allocate up to 30% of their diversified portfolios to the group. Here is how we use our Tech sector ideas from our analysts in our Focus List and Model Portfolios."
Technical Assessment: Bullish in the Intermediate-Term,provide,"It has been a November to remember, so far. Since the October 30 close, the S&P 500 has advanced 9.3% in just a handful of trading days. That can often be a harbinger of better days to come in the market -- particularly when short and furious rallies occur in the final quarter."
Weekly Stock List,provide,"Sustainable Impact Investing is gaining traction not only with Argus Research clients, but also with the global investment community. In January, BlackRock CEO Lawrence Fink, who oversees approximately $7 trillion in assets, announced that his firm would be investing in companies that are making progress on sustainability. Mr. Fink's new focus follows rapid growth in sustainable assets in recent years. According to Opimas, a management consultancy focused on global capital markets, global assets under management in ESG strategies had grown to $40.5 trillion in 2020, doubling in four years and tripling in eight years. There were almost 400 ESG strategies launched in the Morningstar investment universe in 2019, compared with around 160 launches in 2016.  The UN Principles for Responsible Investing -- to which Argus Research is a signatory -- now represents more than 1,750 signatories with assets of US $80 trillion, according to Barron's. As assets have flowed in, SRI investing has evolved over the past 40 years.  Now, instead of merely identifying industries to avoid, the discipline promotes ""sustainable"" business practices across all businesses that can have an ""impact"" on global issues such as workers' rights, poverty, hunger and the climate. Based on numerous requests from clients, we have compiled a list of companies followed by Argus Research that are in position to have this type of ""sustainable impact"" on the environment, workplace and community.  These firms have exemplary records not only in delivering on the bottom line, but also in improving the environment, contributing to community relations, and showing respect for their employees. We derived our list by identifying companies that are either BUY-rated or HOLD-rated by Argus analysts, and also score highly on ESG (Environmental, Social and Governance) criteria established by the JUST Capital Foundation. JUST Capital utilizes a combination of polling, data-driven research, and strategic engagement to shift behaviors and activities in corporate America and the financial markets. JUST Capital's mission is to drive measurable corporate change to create a stakeholder-centric, inclusive form of capitalism that reflects the priorities of the American public.  JUST ranks the Russell 1000 on these criteria against a scale of 1-100. Here are the companies in the Argus Universe that score highest on the scale.  All are rated BUY at Argus."
Analyst Report: Apple Inc,provide,"Apple manufactures Smartphones, tablets, PCs, software and peripherals for a worldwide customer base. Its products include Mac desktop and mobile PCs, iPhone, iPad, Apple Watch, and various consumer products, including AirPods, Beats headphones and Apple TV. Apple services include App Store, iTunes, iCloud, Apple TV+, Apple Arcade, Apple Music, Apple Pay, and more."
Market Update:  TROW,provide,"Stocks fell sharply on Friday morning, led by selloffs in the Technology and Consumer Discretionary sectors. Apple shares fell 5%, despite above-consensus earnings, on concerns about weak iPhone sales and declining revenue in China. The company also declined to provide guidance for the current fiscal first quarter. Amazon also posted strong 3Q results but provided disappointing 4Q earnings guidance, sending the shares down about 4%. The Dow fell 1.5%, the S&P 1.8%, and the Nasdaq 2.7%. Crude oil fell to $35.50 per barrel, while gold rose $12 to $1880 per ounce."
Analyst Report: Apple Inc,provide,"Apple manufactures Smartphones, tablets, PCs, software and peripherals for a worldwide customer base. Its products include Mac desktop and mobile PCs, iPhone, iPad, Apple Watch, and various consumer products, including AirPods, Beats headphones and Apple TV. Apple services include App Store, iTunes, iCloud, Apple TV+, Apple Arcade, Apple Music, Apple Pay, and more."
"Market Digest: AAPL, C, ECL, FTV",provide,"The stock market closed on October 9 with a winning session, ending its best week in three months. With a close at 3,477, the S&P 500 pulled within 3% of its all-time high of 3,588 from 9/2/20, and the index moved higher still on October 12. The September sell-off -- which resulted in a near-correction (defined as down 10%) for the broad market and full corrections for leading Technology names -- cleared away some (only some) of the excessive optimism. It also partly (only partly) restored some sector balance; two of the best sectors in 4Q20-to-date have been out of favor all year."
Analyst Report: Apple Inc,provide,"Apple manufactures Smartphones, tablets, PCs, software and peripherals for a worldwide customer base. Its products include Mac desktop and mobile PCs, iPhone, iPad, Apple Watch, and various consumer products, including AirPods, Beats headphones and Apple TV. Apple services include App Store, iTunes, iCloud, Apple TV+, Apple Arcade, Apple Music, Apple Pay, and more."
"Market Digest: AAPL, C, ECL, FTV",provide,"The stock market closed on October 9 with a winning session, ending its best week in three months. With a close at 3,477, the S&P 500 pulled within 3% of its all-time high of 3,588 from 9/2/20, and the index moved higher still on October 12. The September sell-off -- which resulted in a near-correction (defined as down 10%) for the broad market and full corrections for leading Technology names -- cleared away some (only some) of the excessive optimism. It also partly (only partly) restored some sector balance; two of the best sectors in 4Q20-to-date have been out of favor all year."
Daily Spotlight: Final 2Q GDP Reading: -31.4%,provide,"The U.S. Department of Commerce announced that its ""third"" estimate for 2Q20 GDP growth was a rate of -31.4%. This was in line with the previous estimates and with the consensus outlook. The GDP report also includes an inflation gauge, the PCE price index. This index, excluding food and energy, decreased at a deflationary 0.8% pace, well below the Federal Reserve's inflation target of 2.0%. This second quarter should be the bottom, and GDP reports going forward should signal recovery and ultimately growth. But there's a deep hole out of which the economy must climb. Personal Consumption Expenditures, which are the core of the economy, declined at a 33% rate in the quarter, including a 42% drop in spending on services. Domestic investment fell at a 47% rate, including 36% declines in both residential investment and investment into industrial equipment.  (Even investment into Intellectual Products, such as software and entertainment declined 11%.)  The one growth area was federal government spending, which rose at a 16% rate. That support may be fleeting if Congress is unable to reach another bipartisan rescue package."
The Argus Dividend Growth Portfolio,provide,"Often overlooked amid the market's gyrations, dividend income is an important element of total return. Consider recent results: in 2015, the S&P 500 delivered a total return of 1.4%, including dividends -- but excluding dividends, the market was down 0.7%. Capital gains were a bit easier to achieve in 2016-17, though we note that dividend payments still contributed about 15%-20% of total return for investors. And dividend payments softened the blow in 2018, when most market indices declined as the Federal Reserve hiked rates. Between 1930 and 2012, dividend income accounted for 42% of total return of the S&P 500, according to Morgan Stanley. Not all dividends are created equal, though, and it is important to understand the difference between high-yield stocks and dividend-growth stocks, particularly in a slow-growth or recessionary economic environment."
Analyst Report: Apple Inc,provide,"Apple manufactures Smartphones, tablets, PCs, software and peripherals for a worldwide customer base. Its products include Mac desktop and mobile PCs, iPhone, iPad, Apple Watch, and various consumer products, including AirPods, Beats headphones and Apple TV. Apple services include App Store, iTunes, iCloud, Apple TV+, Apple Arcade, Apple Music, Apple Pay, and more."
"Market Digest: AAPL, CBRL, AVB",provide,"The market has generally skidded lower over trading days spanning two weeks. Is this a healthy correction of an overbought market, or a sign of further market distress to come? We won't know right away -- but, so far, the stock market mainly has unwound much of its August run-up. "
The Argus Dividend Growth Portfolio,provide,"Often overlooked amid the market's gyrations, dividend income is an important element of total return. Consider recent results: in 2015, the S&P 500 delivered a total return of 1.4%, including dividends -- but excluding dividends, the market was down 0.7%. Capital gains were a bit easier to achieve in 2016-17, though we note that dividend payments still contributed about 15%-20% of total return for investors. And dividend payments softened the blow in 2018, when most market indices declined as the Federal Reserve hiked rates. Between 1930 and 2012, dividend income accounted for 42% of total return of the S&P 500, according to Morgan Stanley. Not all dividends are created equal, though, and it is important to understand the difference between high-yield stocks and dividend-growth stocks, particularly in a slow-growth or recessionary economic environment."
Analyst Report: Apple Inc,provide,"Apple manufactures Smartphones, tablets, PCs, software and peripherals for a worldwide customer base. Its products include Mac desktop and mobile PCs, iPhone, iPad, Apple Watch, and various consumer products, including AirPods, Beats headphones and Apple TV. Apple services include App Store, iTunes, iCloud, Apple TV+, Apple Arcade, Apple Music, Apple Pay, and more."
Weekly Stock List,provide,"This is among our most important themes for 2020, and stretches across industries. We think companies that raise their dividends consistently at a double-digit rate are delivering three important signals amid all the recent market volatility:  1) the company's balance sheet is strong enough to pay a dividend; 2) management is focused on providing shareholder returns; and 3) management is confident enough in the near-term outlook to raise the payout aggressively. This third factor is especially important as the pandemic upends the nation's recent record of long-term economic growth.  Here are 13 stocks that meet our double-digit dividend test and are on the Argus BUY List.  They are also new holdings in our Dividend Growth Separately Managed Account and in the Dividend Growers Total Return Trust, sponsored by SmartTrust."
Market Digest:  FSLR,provide,"Stocks rose on Friday, finishing off a strong week that saw major indexes climb higher. Riskier equities outperformed blue chips, a trend that was commonplace during the early weeks of the recovery. On Friday, the Dow Jones Industrial Average gained 162 points, or 0.6%. The S&P 500 was up 0.7% and the Nasdaq Composite was up 0.6%. For the full week, the Dow was up 2.6%, the S&P 500 was up 3.3% and the Nasdaq gained 3.4%. Year-to-date, the DJIA crossed into positive territory this week, and is up 0.4%, the S&P is up 8.6%, and the Nasdaq is up 30.4%. Over the past 52 weeks, the Dow is up 8.5%, the S&P 500 is up 19.9%, and the Nasdaq is up 46.9%. "
Analyst Report: Apple Inc,provide,"Apple manufactures Smartphones, tablets, PCs, software and peripherals for a worldwide customer base. Its products include Mac desktop and mobile PCs, iPhone, iPad, Apple Watch, and various consumer products, including AirPods, Beats headphones and Apple TV. Apple services include App Store, iTunes, iCloud, Apple TV+, Apple Arcade, Apple Music, Apple Pay, and more."
