title,provider,summary
Analyst Report: Apple Inc,provide,"Apple manufactures Smartphones, tablets, PCs, software and peripherals for a worldwide customer base. Its products include Macintosh desktop and mobile PCs, iPhone, iPad, Apple Watch, and various consumer products, including AirPods, Beats headphones and Apple TV. Apple also owns and operates iTunes, the world's largest vendor of recorded music. Apple derives 42%-45% of its revenue from the Americas, 22%-25% from Europe/MEA, and 24%-30% from the Asia-Pacific region."
"Upside surprise, good guidance; reiterating BUY",provide,"Apple manufactures Smartphones, tablets, PCs, software and peripherals for a worldwide customer base. Its products include Macintosh desktop and mobile PCs, iPhone, iPad, Apple Watch, and various consumer products, including AirPods, Beats headphones and Apple TV. Apple also owns and operates iTunes, the world's largest vendor of recorded music. Apple derives 42%-45% of its revenue from the Americas, 22%-25% from Europe/MEA, and 24%-30% from the Asia-Pacific region."
Market Update: BYD,provide,"Stocks edged higher on Wednesday morning as investors awaited a widely expected interest rate cut by the Federal Reserve, along with comments from Fed Chair Jerome Powell. On the earnings front, Apple shares rose more than 4% after the company posted better-than-expected fiscal 3Q results and provided positive sales guidance for fiscal 4Q. The Dow rose 0.1%, the S&P 0.1%, and the Nasdaq 0.3%. Crude oil rose slightly to about $58 per barrel, while gold fell $2 to $1440 per ounce."
Weekly Stock List_06,provide,"The G20 summit in Osaka, Japan, ended on a positive note for investors, as President Trump and China's President Xi Jinping scaled back trade and tariff demands over the weekend.  President Trump said he would refrain from imposing additional tariffs on $300 billion worth of Chinese goods, and the U.S. also lifted the technology-transfer ban on companies that had been working with Chinese telcom company Huawei. The two countries are also continuing to renegotiate the tariffs already imposed.  The sectors that had borne the brunt of the trade wars included Information Technology and Industrials.  Here are five BUY-rated stocks that we think are poised to benefit from the cooling trade tensions."
Daily Spotlight: 1Q GDP ,provide,"The U.S. Department of Commerce announced that its third estimate for 1Q19 GDP growth was a rate of 3.1%. This was in line with the previous estimates and the consensus outlook. There were positive trends in the economy, including capital investments into Intellectual Products (+12%), Structured (+4.3%), Exports (+5.4%) even Federal Government Spending (+2.8%, led by Defense spending, which rose at a 4.0% rate and State and Government spending, which rose at a 4.6% rate). Segments that lagged were Housing (-2.0%), capital investment into Equipment (-1.0%) and the all-important Personal Consumption Expenditures (up only 0.9%).  In short, the headline number looked positive, but some of the details were sketchy. We expect growth in the balance of 2019 to fall into the 2.0%-2.5% range, as trade and tariff concerns weigh on confidence. The GDP report also includes an inflation gauge, the PCE price index. This index, excluding food and energy, increased a paltry 0.5%. That alone may play into the Fed's plans for cutting rates."
Technical Assessment: Bullish in the Intermediate-Term,provide,"We are raising our intermediate-term outlook to bullish, which now aligns with our long-term outlook. All the major indices have finally recaptured their key 200-day moving averages, with the laggard Russell 2000 (RUT) just retaking this average on Tuesday. The average stock in the S&P 500 is now above its 50-day average (56%) for the first time since early May."
The Argus Sustainable ESG Model Portfolio,provide,"Sustainable Impact Investing is gaining traction with the global investment community. According to the Forum for Sustainable and Responsible Investment, global assets under management in the strategy have grown to $11.6 trillion in 2018 from $178 billion in 2005. The UN Principles for Responsible Investing now represents more than 1,750 signatories with assets of US $70 trillion, according to BMO Global Asset Management. As assets have flowed in over the past 40 years, Sustainable Impact Investing has evolved. The discipline, originally known as Socially Responsible Investing, focused at first on excluding companies that conducted business in South Africa, or participated in industries such as tobacco, alcohol and firearms. In time, the list of industries to avoid increased to include soft drinks, fast food, and oil and gas, among numerous others. Performance of these initial strategies lagged, and the approach subsequently has been modified. Now, instead of merely identifying industries to avoid, the discipline promotes ""sustainable"" business practices across all industries that can have an ""impact"" on global issues such as the climate, hunger, poverty, disease, shelter and workers' rights."
Market Digest: CMCSA,provide,"Rally On: Our Monthly Survey of the Economy, Interest Rates, and Markets"
Raising target ,provide,"Apple manufactures Smartphones, tablets, PCs, software and peripherals for a worldwide customer base. Its products include Macintosh desktop and mobile PCs, iPhone, iPad, Apple Watch, and various consumer products, including AirPods, Beats headphones and Apple TV. Apple also owns and operates iTunes, the world's largest vendor of recorded music. Apple derives 42%-45% of its revenue from the Americas, 22%-25% from Europe/MEA, and 24%-30% from the Asia-Pacific region."
Market Digest:NFLX,provide,Economic Data Continues to Send Mixed Signals
QCOM settlement a relief - for AAPL investors; reiterating BUY,provide,"Apple manufactures Smartphones, tablets, PCs, software and peripherals for a worldwide customer base. Its products include Macintosh desktop and mobile PCs, iPhone, iPad, Apple Watch, and various consumer products, including AirPods, Beats headphones and Apple TV. Apple also owns and operates iTunes, the world's largest vendor of recorded music. Apple derives 42%-45% of its revenue from the Americas, 22%-25% from Europe/MEA, and 24%-30% from the Asia-Pacific region."
Millennial Generation Portfolio,provide,A new generation of consumers - the Millennials - has become the largest demographic cohort in the
Daily Spotlight: 4Q GDP ,provide,"The U.S. Department of Commerce announced its ""third"" and final estimate for 4Q18 GDP growth was 2.2%. This is down 40 basis points compared to the ""initial"" estimate of 2.6% and, as we had anticipated, is a further signal that the economy is cooling off from the unsustainable growth rate of 4.2% in 2Q. There were positive trends in the economy, including capital investments into Intellectual Products (+10.7%), Equipment (+6.6%), the all-important Personal Consumer Spending category (+2.5%) and even Federal Government Spending (+1.1%, led by Defense spending, which rose at a 6.4% rate). Segments that lagged were Housing (-4.7%), once again, and State & Local Government Spending (-1.3%).  Exports rebounded from a sharp decline in 3Q that was attributed to tariff talks; but the strong dollar capped export growth at a below-trend 1.8%. The 4Q results benefited from tax cuts, which helped drive consumer spending. But that ""sugar high"" is now in the rear-view mirror. We expect growth in 1H19 in the 1.5%-2.0% range, reflecting disruption in the economy from the government shutdown.  The GDP report also includes an inflation gauge, the PCE price index.  This index, excluding food and energy, increased at a modest 1.8% pace. This report will not likely lead the Fed to alter its current stance."
Mixed reviews for streaming ignore still-powerful ecosystem; reiterating BUY,provide,"Apple manufactures Smartphones, tablets, PCs, software and peripherals for a worldwide customer base. Its products include Macintosh desktop and mobile PCs, iPhone, iPad, Apple Watch, and various consumer products, including AirPods, Beats headphones and Apple TV. Apple also owns and operates iTunes, the world's largest vendor of recorded music. Apple derives 42%-45% of its revenue from the Americas, 22%-25% from Europe/MEA, and 24%-30% from the Asia-Pacific region."
Market Update: BUD,provide,"Stocks fell on Wednesday morning amid continued concerns about global growth, with all sectors moving lower. The U.S. trade deficit was narrower than expected. The Commerce Department said that the trade gap narrowed by 14.6% to $51.8 billion in January, reflecting higher exports of soybeans, motor vehicles and parts and lower imports. The Reuters consensus forecast had called for a smaller decline to $57.0 billion. The Dow fell 0.8%, the S&P 1.0%, and the Nasdaq 1.3%. Crude oil fell slightly to just under $60 per barrel, while gold fell $6 to $1309 per ounce."
Attractive price points; reiterating BUY,provide,"Apple manufactures Smartphones, tablets, PCs, software and peripherals for a worldwide customer base. Its products include Macintosh desktop and mobile PCs, iPhone, iPad, Apple Watch, and various consumer products, including AirPods, Beats headphones and Apple TV. Apple also owns and operates iTunes, the world's largest vendor of recorded music. Apple derives 42%-45% of its revenue from the Americas, 22%-25% from Europe/MEA, and 24%-30% from the Asia-Pacific region."
Market Update:  ZTS,provide,"Stocks fell sharply on Thursday morning, led by the Basic Materials and Financial sectors, as concerns about a slowing global economy led the European Central Bank to announce new stimulus measures. The ECB cut its global growth and inflation targets and also said that it would delay any interest rate hikes until at least 2020. The Dow fell 1.0%, the S&P 1.2%, and the Nasdaq 1.1%. Crude oil rose slightly to about $56 per barrel, while gold fell $1.50 to $1286 per ounce."
Relief rally as services revenue rise; reiterating BUY,provide,"Apple manufactures Smartphones, tablets, PCs, software and peripherals for a worldwide customer base. Its products include Macintosh desktop and mobile PCs, iPhone, iPad, Apple Watch, and various consumer products, including AirPods, Beats headphones and Apple TV. Apple also owns and operates iTunes, the world's largest vendor of recorded music. Apple derives 42%-45% of its revenue from the Americas, 22%-25% from Europe/MEA, and 24%-30% from Asia-Pacific."
Market Update: PKG,provide,"The major indices are 0up at midday on Wednesday. FAANG stocks are some of the early-session leaders, trading up in sympathy with Apple after yesterday's well-received earnings call, and ahead of earnings from Microsoft and Facebook this afternoon. With no rate change expected at today's Federal Reserve meeting, investors will be looking for hints of what the future may hold when Fed Chair Jerome Powell speaks with the media. Industries doing well today include Technology Hardware, Storage & Peripherals, Internet & Direct Marketing Retail, and Health Care Providers & Services. Industries showing weakness include Diversified Telecommunication Services, Media, and Biotechnology. The VIX is down 0.01 to 19.12 after the previous close of 19.13. The Dow rose 1.5%, the S&P 1.0%, and the Nasdaq 1.3%. Crude oil rose nearly 3% to about $55 per barrel, while gold rose slightly to trade near $1316 per ounce."
Market Update:  OGE,provide,"Stocks plunged on Thursday morning following reduced revenue guidance from Apple, which cited slower demand for iPhones, and disappointing manufacturing data. The Institute for Supply Management said that its manufacturing index fell to 54.1 in December, below the Reuters consensus forecast of 57.9 and down sharply from November. The Dow fell 2.5%, the S&P 2.0%, and the Nasdaq 2.2%. Crude oil fell 1% to about $46 per barrel, while gold rose $8 to $1292 per ounce."
Cutting estimates on iPhone weakness; reiterating BUY,provide,"Apple manufactures Smartphones, tablets, PCs, software and peripherals for a worldwide customer base. Its products include Macintosh desktop and mobile PCs, iPhone, iPad, Apple Watch, and various consumer products, including AirPods, Beats headphones and Apple TV. Apple also owns and operates iTunes, the world's largest vendor of recorded music. Apple derives 42%-45% of its revenue from the Americas, 22%-25% from Europe/MEA, and 24%-30% from Asia-Pacific."
Daily Spotlight: 3Q GDP ,provide,"The U.S. Department of Commerce announced that its third and final estimate for 3Q18 GDP growth was a strong rate of 3.4%. This was down 10 basis points compared to the previous estimate and, as we had anticipated, was lower than the impressive-but-unsustainable rate of 4.2% in 2Q.  Even so, growth was broad-based, including capital investments into Intellectual Products (+5.6%), Equipment (+3.4%), the all-important Personal Consumer Spending category (+3.5%) and even Federal Government Spending (+3.5%, led by Defense spending).  The segments that lagged were Housing (-3.6%), once again, and Exports (-4.9% and reflecting tariff turmoil as well as a strong dollar). The 3Q results benefited from the Trump tax cuts, which helped drive consumer spending. But the tax-cut ""sugar high"" will be winding down after one more quarter. We expect growth in 4Q in the 3% range, but look for a further slowdown into 2019-2020 as housing and exports continue to weigh. As the slowdown progresses, we anticipate that the Federal Reserve will slow down its pace of interest-rate hikes."
Market Update: BHP,provide,"Stocks rallied on Wednesday, led by the Technology and Consumer Discretionary sectors, after Fed Chair Jerome Powell lowered concerns about aggressive interest rate hikes next year. Meanwhile, the Commerce Department said that the U.S. economy grew at a 3.5% annualized rate in the third quarter, unchanged from its prior estimate but down from 4.2% growth in 2Q. The Dow rose 1.9%, the S&P 1.6%, and the Nasdaq 1.9%. Crude oil rose slightly to about $52 per barrel, while gold traded near $1223 per ounce."
Under pressure from tariffs and demand concerns,provide,"Apple manufactures PCs, MP3 players, smartphones, tablet computers, software and peripherals for a worldwide customer base. Its products include the Macintosh line of desktop and mobile PCs, the iPod MP3 line, the iPhone, the iPad, and various consumer products, including Apple TV. Apple also owns and operates iTunes, the world's largest vendor of recorded music. Apple derives 40%-45% of its revenue from the Americas, 20%-25% from Europe/MEA, 12%-16% from Asia-Pacific, and 15%-18% from its own retail stores."
Weekly Stock List,provide,"The FAANG Stocks - Facebook, Apple, Amazon, Netflix and Google - had been leading the broad market higher over the past two years. And, in the past month, these five Wall Street darlings have led the broad market into correction territory. In August, Apple crossed the trillion-dollar market cap line, and Amazon followed in October. Now, in late November, these five stocks have lost over $1 trillion in market cap collectively. Here are our views on the near-term status of these stocks."
High phone ASPs reinforce margins; reiterating BUY,provide,"Apple manufactures PCs, MP3 players, smartphones, tablet computers, software and peripherals for a worldwide customer base. Its products include the Macintosh line of desktop and mobile PCs, the iPod MP3 line, the iPhone, the iPad, and various consumer products, including Apple TV. Apple also owns and operates iTunes, the world's largest vendor of recorded music. Apple derives 40%-45% of its revenue from the Americas, 20%-25% from Europe/MEA, 12%-16% from Asia-Pacific, and 15%-18% from its own retail stores."
Market Update: ANET,provide,"Stocks fell on Friday morning following the October employment report, as strong wage growth raised the likelihood of a Fed interest rate hike in December. The Labor Department said that the U.S. economy added 250,000 payroll jobs last month, up from a revised 118,000 in September and above the Reuters consensus forecast of 190,000. The official unemployment rate held steady at 3.7%, while average hourly wages rose 3.1% from the prior year. The S&P fell 0.9%, the Dow 0.7%, and the Nasdaq 1.3%. Crude oil traded near $63 per barrel, while gold fell $7 to $1232 per ounce."
Min Vol Model Portfolio,provide,"With the stock market racing to new highs earlier this year, most mainstream investors were either looking to get aboard or stay aboard the galloping bull. As the market was lifted higher by the FAANG stocks, many investors likely became over-allocated to a couple of high risk-reward sectors. Even while riding the rally � and the recent ups and downs � some investors are considering end-of-rally strategies. Minimum volatility, or �Min Vol,� often falls into that defensive category."
Market Digest: TSLA,provide,"Stocks rose on Friday, finishing off a strong week that saw major indexes climb higher. Riskier equities outperformed blue chips, a trend that was commonplace during the early weeks of the recovery. On Friday, the Dow Jones Industrial Average gained 162 points, or 0.6%. The S&P 500 was up 0.7% and the Nasdaq Composite was up 0.6%. For the full week, the Dow was up 2.6%, the S&P 500 was up 3.3% and the Nasdaq gained 3.4%. Year-to-date, the DJIA crossed into positive territory this week, and is up 0.4%, the S&P is up 8.6%, and the Nasdaq is up 30.4%. Over the past 52 weeks, the Dow is up 8.5%, the S&P 500 is up 19.9%, and the Nasdaq is up 46.9%. "
Analyst Report: Apple Inc,provide,"Apple manufactures Smartphones, tablets, PCs, software and peripherals for a worldwide customer base. Its products include Mac desktop and mobile PCs, iPhone, iPad, Apple Watch, and various consumer products, including AirPods, Beats headphones and Apple TV. Apple services include App Store, iTunes, iCloud, Apple TV+, Apple Arcade, Apple Music, Apple Pay, and more."
The Argus ESG Model Portfolio,provide,"Sustainable Impact Investing is gaining traction with the global investment community. In January, BlackRock CEO Lawrence Fink, who oversees approximately $7 trillion in assets, announced that his firm would be investing in companies that are making progress on sustainability. Mr. Fink's new focus follows rapid growth in sustainable assets in recent years. According to Opimas, a management consultancy focused on global capital markets, global assets under management in ESG strategies had grown to $40.5 trillion in 2020, doubling in four years and tripling in eight years. As assets have flowed in over the past 40 years, Sustainable Impact Investing has evolved. The discipline, originally known as Socially Responsible Investing, focused at first on excluding companies for various reasons. Now, the discipline promotes ""sustainable"" business practices across all industries that can have an ""impact"" on global issues."
Analyst Report: Apple Inc,provide,"Apple manufactures Smartphones, tablets, PCs, software and peripherals for a worldwide customer base. Its products include Mac desktop and mobile PCs, iPhone, iPad, Apple Watch, and various consumer products, including AirPods, Beats headphones and Apple TV. Apple services include App Store, iTunes, iCloud, Apple TV+, Apple Arcade, Apple Music, Apple Pay, and more."
Market Update: BA,provide,"Stocks were mixed on Friday morning as investors weighed strong earnings reports from major technology companies and positive consumer spending data. The Commerce Department said that U.S. consumer spending rose 5.6% in June, down from 8.5% in May, but above the Reuters consensus forecast of 5.5% growth. The Dow fell 0.5%, the S&P fell 0.1%, and the Nasdaq rose 0.7%. Crude oil rose slightly to $40 per barrel, while gold jumped $28 to $1970 per ounce."
The Argus Innovation Model Portfolio,provide,"Innovation may be hard to define but, to borrow from former U.S. Supreme Court Justice Potter Stewart, you know it when you see it. The United States economy is full of innovation. It has to be. Manufacturing industries that dominated the economy decades ago - textiles, televisions, even automobiles, to a large degree - have moved overseas, where costs are lower. Yet the U.S. economy, prior to the pandemic, had expanded to record levels. And now the U.S. Healthcare industry is mobilizing to improve COVID-19 testing, treatments and, ultimately, a vaccine. If U.S. corporations weren't innovating, creating new products and services and moving into new markets and applications, the domestic economy would not have recently completed a 10-year expansion phase before the coronavirus hit, and capital would not be flooding into the country. A couple of statistics should help illustrate our point. Consider that U.S. GDP was approximately $1 trillion in 1930 but nearly $22 trillion in 2019. That's growth of 22-times. Meanwhile, the U.S. population has grown less than 3-times during that time span, to 320 million from 120 million. The delta between GDP growth and population growth has been driven in large part by innovation. In addition, the value of listed corporations on U.S. stock exchanges at the end of 2018 was approximately $32 trillion, representing 41% of global equity market capitalization, while U.S. GDP represented only 25% of global GDP."
The Argus Millennial Generation Model Portfolio,provide,"We have published our latest version of the Argus Millennial Generation portfolio. This new generation of consumers - the Millennials - has recently become the largest demographic cohort in the country, and this group, with new lifestyle preferences and different career goals, is demanding a new menu of sustainable products and services. The intersection of important Millennial trends - sustainability, healthier living, an entrepreneurial spirit - has resulted in the emergence and growth of numerous companies well suited to the new generation. Many of these companies are expected to be future industry leaders and are included in the dynamic Argus Universe of Coverage. A diversified portfolio, of course, is more than just a list of companies linked to themes. To build the Argus Millennial Generation Portfolio, we applied financial concepts such as industry diversification, income generation, risk reduction and growth at a reasonable price."
Daily Spotlight: Economic Data Hits the Tape,provide,"Investors had numerous economic reports to digest this morning before the market opened. The US Department of Commerce announced that its ""third"" estimate for 1Q20 GDP growth was a rate of -5.0%.  This was in line with the previous estimates and with the consensus outlook. The GDP report also includes an inflation gauge, the PCE price index. This index, excluding food and energy, increased at a 1.7% pace -- below the Federal Reserve's inflation target of 2.0%. Remember, these readings were for the first quarter; they will get worse in the second quarter. Still, the second quarter should be the bottom. This morning's Durable Goods report indicated an increase in spending on Durable Goods by 15.8% in May versus a decline of 17.7% in April. The Commerce Department also reported that the trade deficit in goods widened in May (bad for 2Q GDP) and that wholesale inventories declined (good for 3Q GDP, as inventories are replenished).  The U.S. Department of Labor reported that another 1.48 million people filed initial unemployment claims.  While still high, the readings have been declining from week to week.  Even so, the continuing claims number remained above 20 million. This typically has been a close approximation to the unemployment rate, which is likely to be at least 13% when reported next week."
Analyst Report: Apple Inc,provide,"Apple manufactures Smartphones, tablets, PCs, software and peripherals for a worldwide customer base. Its products include Mac desktop and mobile PCs, iPhone, iPad, Apple Watch, and various consumer products, including AirPods, Beats headphones and Apple TV. Apple services include App Store, iTunes, iCloud, Apple TV+, Apple Arcade, Apple Music, Apple Pay, and more."
Market Update:XEL,provide,"Stocks rose on Tuesday morning amid improved business activity and housing market data, along with reassurances from President Trump that the U.S.-China trade deal was 'fully intact.' The president's comments came after White House trade adviser Peter Navarro suggested in a television interview that the deal was 'over.' Mr. Navarro said that his comments were taken 'wildly out of context.' On the housing front, the Commerce Department said that U.S. new home sales rose 16.6% to a seasonally adjusted annual rate of 676,000 units in May, above the Reuters consensus forecast of 640,000. The Dow rose 0.9%, the S&P 1.0%, and the Nasdaq 1.3%. Crude oil traded near $41 per barrel, while gold rose $18 to $1784 per ounce."
Technical Assessment: Bullish in the Intermediate-Term,provide,"When the pandemic hit, people waited for things to get back to normal. Now we realize that what lies ahead is a new normal, not the old normal. Investors also are living within a new normal, and the chief characteristic is volatility."
